{
  "$schema": "https://oneshot.gallery/schema/entry.json",
  "slug": "forest",
  "no": 49,
  "title": {
    "en": "FOREST — Deep Canopy Retreat",
    "ko": "숲 — 깊은 수관의 은신처"
  },
  "description": {
    "en": "A forest retreat where the page grows overhead — canopy layers darken as you scroll deeper, dappled light filters through. The third organic-nature, distinct from sup and dream.",
    "ko": "A forest retreat where the page grows overhead — canopy layers darken as you scroll deeper, dappled light filters through. The third organic-nature, distinct from sup and dream."
  },
  "aesthetic": "organic-nature",
  "techniques": [
    "scroll-scrub-pinned",
    "feturbulence-texture",
    "pointer-parallax"
  ],
  "industry": [
    "wellness"
  ],
  "stack": {
    "animation": "vanilla-js",
    "styling": "vanilla-css",
    "renderer": [
      "dom",
      "svg"
    ]
  },
  "dependencies": [],
  "prompt": {
    "model": "builtin:zai-coding-plan/GLM-5.2",
    "modelLabel": "GLM-5.2",
    "tool": "zcode-cli",
    "date": "2026-07-27",
    "oneshot": false,
    "followUps": 0
  },
  "media": {
    "source": "hybrid",
    "provenance": {
      "en": "The far canopy layer is a single generated painterly forest photo — ComfyUI on the Illustrious checkpoint bismuthIllustrious_v80 at 1536x640, 30 steps, CFG 5.5, encoded to AVIF + WebP (~200 KB). It is darkened to 42% opacity and tinted so it reads as atmosphere behind the CSS leaf shapes, which remain code. Full recipe in PROMPT.md image-recipe.",
      "ko": "멀리 수관 레이어 한 장은 생성된 그림풍 숲 사진 — ComfyUI의 Illustrious 계열 체크포인트 bismuthIllustrious_v80, 1536x640, 30스텝, CFG 5.5, AVIF + WebP 인코딩(약 200KB). 코드로 그린 잎 모양 뒤에 대기로 읽히도록 42% 불투명도로 어둡게 하고 틴트를 입혔다. 전체 레시피는 PROMPT.md의 image-recipe에."
    },
    "budgetKB": 5120
  },
  "theme": "light",
  "accent": "#15803d",
  "credits": [],
  "license": "MIT",
  "published": "2026-07-27",
  "featured": false
}